{
  "notes": "The smallest World the format allows: four tracks, one progression, four scenes, no patterns. tests/world_test.c and tests/worldc_test.py use it.",
  "format": "flowstate-world/1",
  "id": "test_minimal",
  "name": "MINIMAL",
  "category": "TEST",
  "tempo": {"bpm": 100},
  "key": {"root": "C", "scale": "MAJ"},
  "tracks": [
    {"name": "pad", "role": "pad", "sound": {"engine": "ANALOG", "preset": "WARM PAD"}},
    {"name": "bass", "role": "bass", "sound": {"engine": "ANALOG", "preset": "SUB BASS"}},
    {"name": "keys", "role": "lead", "sound": {"engine": "DIGITAL", "preset": "RHODES"}},
    {"name": "drums", "role": "drums", "sound": {"kit": "808"}}
  ],
  "progressions": {"home": ["I:4"]},
  "scenes": {
    "A": {"name": "INTRO", "role": "intro", "progression": "home"},
    "B": {"name": "MAIN", "role": "main", "progression": "home"},
    "C": {"name": "LIFT", "role": "lift", "progression": "home"},
    "D": {"name": "BREAKDOWN", "role": "breakdown", "progression": "home"}
  },
  "smart_keys": {"track": "keys"}
}
